,name_img,tipo_oferta,position,url_img,datetime_checked,promocion,publico_objetivo,categorias_en_promo,marcas_en_promo,productos_en_oferta,cuotas_sin_interes,cupon_app,promociones_envio
0,zapatillas,ofertas_principales,1,https://images.falabella.com/v3/assets/blt7c5c2f2f888a7cc3/blt4e499ae72c79dd1c/65e640663e2d0ef5c9f73180/Zapatillas-040324-mb.jpg,2024-03-05 19:04:50.526096,"40% de descuento en zapatillas de mujer, hombre y niño. ¡Aprovecha esta oportunidad!",Hombres y mujeres que buscan zapatillas deportivas de calidad a buen precio.,"['zapatillas', 'deporte', 'fitness']","['adidas', 'fila', 'asics', 'new balance']","[{'nombre_del_producto': 'Zapatillas Adidas Runfalcon 2.0', 'precio_normal': '$100.000', 'precio_oferta': '$60.000', 'descuento': '40%'}, {'nombre_del_producto': 'Zapatillas Fila Disruptor II', 'precio_normal': '$80.000', 'precio_oferta': '$48.000', 'descuento': '40%'}, {'nombre_del_producto': 'Zapatillas Asics Gel-Contend 7', 'precio_normal': '$120.000', 'precio_oferta': '$72.000', 'descuento': '40%'}]",,,
1,perfumes,ofertas_principales,2,https://images.falabella.com/v3/assets/blt7c5c2f2f888a7cc3/bltb68e430a7f015f4b/65e61bf47c85265522236640/Perfumes-Belleza-Vitrina-dk-040324-NM.jpg,2024-03-05 19:04:50.526096,30% de descuento en productos seleccionados de belleza y cuidado personal,Hombres y mujeres que buscan productos de belleza y cuidado personal de alta calidad.,"['Perfumes', 'Belleza', 'Cuidado personal']","['Lancome', 'Ralph Lauren', 'Giorgio Armani']","[{'nombre_del_producto': 'Lancome La Vie Est Belle', 'precio_normal': '$100', 'precio_oferta': '$70', 'descuento': '30%'}, {'nombre_del_producto': 'Ralph Lauren Polo Blue', 'precio_normal': '$80', 'precio_oferta': '$56', 'descuento': '30%'}, {'nombre_del_producto': 'Giorgio Armani Acqua di Gioia', 'precio_normal': '$90', 'precio_oferta': '$63', 'descuento': '30%'}]",,,Envío en 24hs para productos seleccionados
2,apple week,ofertas_principales,3,https://images.falabella.com/v3/assets/blt7c5c2f2f888a7cc3/blt76c90f30f0126599/65e2207231aca198237f030a/AppleWeek-Vitrina-dk-040324-NM.jpg,2024-03-05 19:04:50.526096,Hasta 12 cuotas sin interés en productos Apple seleccionados.,Personas interesadas en productos Apple.,"['iPhone', 'iPad', 'Macbook']",['Apple'],[],12.0,,
3,muebles,ofertas_principales,4,https://images.falabella.com/v3/assets/blt7c5c2f2f888a7cc3/blt18aa2257753fa845/65e22bb7ffa94a122f3d505e/04-vitrina-DK-Muebles-040324-PS.jpg,2024-03-05 19:04:50.526096,Hasta 60% de descuento en muebles,Personas que buscan amueblar su casa o departamento con productos de calidad a buen precio,"['muebles', 'sillones', 'mesas']","['Deco Class', 'Vekka Home']","[{'nombre_del_producto': 'Sillón 3 cuerpos Deco Class Tela Velvet Arezzo', 'precio_normal': '$349.990', 'precio_oferta': '$239.990', 'descuento': '32%'}, {'nombre_del_producto': 'Comedor 4 sillas Vekka Home Celine Leone', 'precio_normal': '$219.990', 'precio_oferta': '$99.990', 'descuento': '55%'}]",6.0,,
4,computacion ,ofertas_principales,5,https://images.falabella.com/v3/assets/blt7c5c2f2f888a7cc3/blt338565db7691a5f0/65e767511ab2dc2107979a92/05-Vitrina-DK-Computacion-040324-CS.jpg,2024-03-05 19:04:50.526096,"Hasta 10 cuotas sin interés en notebooks, computadoras, tablets e impresoras. ","Estudiantes y profesionales que buscan adquirir una notebook, computadora o tablet a un precio accesible.","['Notebooks', 'Computadoras', 'Tablets']","['HP', 'Asus', 'Samsung']","[{'nombre_del_producto': 'Notebook HP 15 i5 4 nucleos 512GB SSD 14"" FHD', 'precio_normal': '$669.990', 'precio_oferta': '$429.990', 'descuento': '36%'}, {'nombre_del_producto': 'Notebook Asus Vivobook 14 i5 512GB SSD 14"" FHD', 'precio_normal': '$659.990', 'precio_oferta': '$429.990', 'descuento': '35%'}]",10.0,,
5,camas,ofertas_principales,6,https://images.falabella.com/v3/assets/blt7c5c2f2f888a7cc3/bltd82409f64a85eb65/65e63ccf2c8bef2d47623a47/06-Vitrina-dk-CAMAS-040324-CS.jpg,2024-03-05 19:04:50.526096,,,,,,,,
6,20% calzado escolar	,ofertas_secundarias,1,https://images.falabella.com/v3/assets/blt7c5c2f2f888a7cc3/bltb6057076aae8c777/65e642223b4c4fb9fa7afae9/Hardsell-01-CalzadoEscolar-040324-DH.jpg,2024-03-05 19:04:50.526096,20% de descuento en calzado escolar seleccionado,Padres de ninos en edad escolar,"['calzado', 'escolar', 'ninos']","['holley', 'diadora']","[{'nombre_del_producto': 'Zapatillas urbanas Holley', 'precio_normal': '$5.990', 'precio_oferta': '$4.790', 'descuento': '20%'}, {'nombre_del_producto': 'Zapatillas urbanas Diadora', 'precio_normal': '$6.990', 'precio_oferta': '$5.590', 'descuento': '20%'}]",,,
7,mochilas escolares 30%,ofertas_secundarias,2,https://images.falabella.com/v3/assets/blt7c5c2f2f888a7cc3/blt1b1c3badf71c8047/65e528c777ae45b737b10b70/Hardsell-02-Mochilas-040324-DH.jpg,2024-03-05 19:04:50.526096,30% de descuento en mochilas escolares,Padres y madres que buscan comprar mochilas escolares para sus hijos.,"['Mochilas', 'Escolares', 'Niños']","['Yamp', 'Doo', 'Maui']","[{'nombre_del_producto': 'Mochila escolar Doo Australia', 'precio_normal': '$5.000', 'precio_oferta': '$3.500', 'descuento': '30%'}, {'nombre_del_producto': 'Mochila escolar Yamp', 'precio_normal': '$4.000', 'precio_oferta': '$2.800', 'descuento': '30%'}, {'nombre_del_producto': 'Mochila escolar Maui', 'precio_normal': '$3.000', 'precio_oferta': '$2.100', 'descuento': '30%'}]",,,Envío en 24hs para productos seleccionados
8,uniformes escolares,ofertas_secundarias,3,https://images.falabella.com/v3/assets/blt7c5c2f2f888a7cc3/blt043354dbd2e8a213/65e528c73b4c4f69a67af3c8/Hardsell-03-Uniformes-040324-DH.jpg,2024-03-05 19:04:50.526096,6 cuotas sin interés pagando con CMR Falabella,Niños y niñas en edad escolar,"['Vestuario', 'Uniformes', 'Ropa escolar']","['Hobley', 'Colloky', 'Mau & Mau']",[],6.0,,
9,utiles escolares y libros 40%,ofertas_secundarias,4,https://images.falabella.com/v3/assets/blt7c5c2f2f888a7cc3/bltcbb7bd71cefc27cc/65e528c76c65d7e88b87f5dc/Hardsell-04-Utiles-040324-DH.jpg,2024-03-05 19:04:50.526096,40% de descuento en útiles escolares seleccionados,Estudiantes y/o personas que necesitan útiles escolares.,"['utiles', 'escolares', 'marcadores']","['proarte', 'sharpie']","[{'nombre_del_producto': 'Cuaderno espiral tapa dura Hello Kitty', 'precio_normal': None, 'precio_oferta': None, 'descuento': '40%'}, {'nombre_del_producto': 'Set de marcadores Proarte', 'precio_normal': None, 'precio_oferta': None, 'descuento': '40%'}]",,,
10,vestuario nueva temporada,grid_ofertas,1,https://images.falabella.com/v3/assets/blt7c5c2f2f888a7cc3/bltf6d59e89a5498313/65e20fec4487d0cffd4003b8/MC-1-1-DK-VestNT-040324-CS.jpg,2024-03-05 19:04:50.526096,30% de descuento en productos seleccionados,Familias con niños,"['Ropa', 'Calzado', 'Accesorios']","['Mango', 'Americanino', ""Carter's""]",[],,,
11,serum belleza,grid_ofertas,2,https://images.falabella.com/v3/assets/blt7c5c2f2f888a7cc3/bltc904bc251719196e/65e20fec3b4c4f429b7aefd7/MC-1-2-DK-Bellezaa-040324-CS.jpg,2024-03-05 19:04:50.526096,30% de descuento en productos seleccionados de belleza,Mujeres de 25 a 45 años interesadas en el cuidado de la piel,"['Belleza', 'Cuidado de la piel', 'Serum']","['Lancome', 'Vichy', 'Estee Lauder']","[{'nombre_del_producto': 'Lancome Advanced Genifique Serum', 'precio_normal': None, 'precio_oferta': None, 'descuento': '30%'}, {'nombre_del_producto': 'Vichy Liftactiv Supreme H.A. Filler Serum', 'precio_normal': None, 'precio_oferta': None, 'descuento': '30%'}, {'nombre_del_producto': 'Estee Lauder Advanced Night Repair Synchronized Multi-Recovery Complex', 'precio_normal': None, 'precio_oferta': None, 'descuento': '30%'}]",,,Envío en 24 horas para productos seleccionados
12,vestuario deportivo nueva temporada,grid_ofertas,3,https://images.falabella.com/v3/assets/blt7c5c2f2f888a7cc3/blt44a608670da7c6d7/65e20fed72b3873cac22cc40/MC-1-3-DK-VestDeportivo-040324-CS.jpg,2024-03-05 19:04:50.526096,30% de descuento en ropa deportiva de Adidas y Nike,Hombres y mujeres que buscan ropa deportiva de marca a buen precio,"['Ropa deportiva', 'Adidas', 'Nike']","['Adidas', 'Nike']",[],,,
13,videojuegos ,grid_ofertas,4,https://images.falabella.com/v3/assets/blt7c5c2f2f888a7cc3/bltf42bef80e1b07572/65e5c163f86c24b8b48e2208/MC-2-1-Playstation-dk-040324-DH.png,2024-03-05 19:04:50.526096,"Lleva la PlayStation 5 Slim Standard con 2 juegos a un precio rebajado. Antes $659.990, ahora $639.990","Gamers, personas interesadas en tecnologia y videojuegos","['Consolas', 'Videojuegos', 'Tecnologia']","['Sony', 'PlayStation']",[],,,
14,television,grid_ofertas,5,https://images.falabella.com/v3/assets/blt7c5c2f2f888a7cc3/blt5ef055edd4b0c60e/65e77353ed37f67a44b10371/MC-2-2-TV-dk-040324-DH.jpg,2024-03-05 19:04:50.526096,Hasta 10 cuotas sin interés en televisores Philips,Personas que buscan televisores inteligentes de alta gama.,"['Televisores', 'Smart TV', 'Philips']",['Philips'],"[{'nombre_del_producto': 'Philips Led UHD 4K Ambilight', 'precio_normal': 529.99, 'precio_oferta': 329.99, 'descuento': '38%'}]",10.0,,
15,linea blanca,grid_ofertas,6,https://images.falabella.com/v3/assets/blt7c5c2f2f888a7cc3/blt64bff844883e4303/65e78ac170389a3eb5f663f7/MC-2-3-dk-Lineablanca-040324-DH.jpg,2024-03-05 19:04:50.526096,Hasta 30% off en heladeras y lavarropas,Familias que buscan renovar sus electrodomésticos,"['Linea blanca', 'Electrodomésticos', 'Samsung']","['Samsung', 'Midea']","[{'nombre_del_producto': 'Heladera Samsung 298 litros', 'precio_normal': '$549.990', 'precio_oferta': '$379.990', 'descuento': '31%'}, {'nombre_del_producto': 'Lavarropas Midea 14 kg', 'precio_normal': '$329.990', 'precio_oferta': '$229.990', 'descuento': '29%'}]",,,
16,"ropa de cama, sabanas",grid_ofertas,7,https://images.falabella.com/v3/assets/blt7c5c2f2f888a7cc3/blt92931e7cdc86918c/65e63ac1330e0054cf7f8f9e/Sabanas-MC3-1-dk-040324-NM.jpg,2024-03-05 19:04:50.526096,,,,,,,,
17,iluminacion,grid_ofertas,8,https://images.falabella.com/v3/assets/blt7c5c2f2f888a7cc3/blte9f5814e174af457/65e22257ee3a130815c90106/Iluminacion-MC3-2-dk-040324-NM.jpg,2024-03-05 19:04:50.526096,3x2 en productos seleccionados,Público en general,"['Iluminación', 'Hogar', 'Decoración']",,[],,,
18,fitness,grid_ofertas,9,https://images.falabella.com/v3/assets/blt7c5c2f2f888a7cc3/bltd8243153b6d261d2/65e22258ae62f75c624bff70/Trotadora-MC3-3-dk-040324-NM.jpg,2024-03-05 19:04:50.526096,Smartband de regalo con la compra de la trotadora eléctrica YEP S,Personas interesadas en mantenerse en forma y cuidar su salud.,"['Deportes', 'Fitness', 'Salud']",['YEP SPORT'],"[{'nombre_del_producto': 'Trotadora eléctrica YEP S 3 niveles', 'precio_normal': 499.99, 'precio_oferta': 259.99, 'descuento': '48%'}]",,,Envío en 24 horas para productos seleccionados
19,desktop-category-image,lo_ultimo,1,https://images.falabella.com/v3/assets/blt7c5c2f2f888a7cc3/blt311beea7367b77c1/65e53e9f31aca1eacc7f066f/01-LoUltimo-Pantalones-040324-dk-PS.jpg,2024-03-05 19:04:50.526096,Lleva los pantalones Sybilla a $12.990,Mujeres jóvenes y adultas que buscan ropa de moda a buen precio.,"['pantalones', 'moda', 'mujer']",['Sybilla'],[],,,
20,desktop-category-image,lo_ultimo,2,https://images.falabella.com/v3/assets/blt7c5c2f2f888a7cc3/blt3782875f89d7e7b0/65e5373b4487d0a9a7400755/02-LoUltimo-DC-040324-dk-PS.jpg,2024-03-05 19:04:50.526096,zapatillas dc court graffik con un 20% de descuento,hombres jovenes que practican deportes extremos,"['zapatillas', 'dc', 'skate']",['dc'],[],,,
21,desktop-category-image,lo_ultimo,3,https://images.falabella.com/v3/assets/blt7c5c2f2f888a7cc3/blt628440034a071ef1/65e5373b375999263e70cb41/03-LoUltimo-Adidas-040324-dk-PS.jpg,2024-03-05 19:04:50.526096,Supernova: Zapatillas de running con amortiguación y comodidad insuperables.,Hombres y mujeres que buscan zapatillas para running de alta calidad.,"['zapatillas', 'deportes', 'adidas']",['adidas'],[],,,
